[
  {
    "schema_version": "3.0.0",
    "study_internal_id": "STUDY001",
    "study_title": "Schema 3.0.0 fixture study",
    "study_short_description": "A minimal package used for validator integration tests.",
    "study_sample": "One adult participant",
    "study_groups": [
      {
        "study_group_name": "main",
        "study_group_datasets": [
          "DS001"
        ]
      }
    ],
    "study_setting": "Laboratory",
    "study_geographical_location": "Berlin, Germany",
    "study_datasets": [
      "DS001"
    ]
  }
]
